{"fork_revision":"5133e999d2c97a61542b784e322d1b131dfae106","identities":["code-review","file-mr","fix-code-audit","fix-code-review","quality-checklist","security-audit"],"manifest":{"absent_identities":["fix-code-audit","security-audit"],"entries":[{"mode":"0755","owner_policy":"target-root","path":"code-review","type":"directory"},{"mode":"0644","owner_policy":"target-root","path":"code-review/SKILL.md","sha256":"70d013d7c9f50726547157afb4aa24b9ebc5b632f3621741a3406a7b458cf0f2","size":22873,"type":"file"},{"mode":"0755","owner_policy":"target-root","path":"code-review/templates","type":"directory"},{"mode":"0644","owner_policy":"target-root","path":"code-review/templates/_index.md","sha256":"f6e301dd4bd7919d47fe8d03475c9966b057fd01b7f134a0af2aab0e58bbce81","size":14568,"type":"file"},{"mode":"0755","owner_policy":"target-root","path":"code-review/templates/architecture","type":"directory"},{"mode":"0644","owner_policy":"target-root","path":"code-review/templates/architecture/idempotency.md","sha256":"9bcbad90ca27202c6a71a82d9f43231624b00cdf090c99875ccfe6aa93b4c16b","size":4471,"type":"file"},{"mode":"0644","owner_policy":"target-root","path":"code-review/templates/architecture/separation_of_concerns.md","sha256":"223075b30036face794a1743288f6a04b622257503e0d755021908d8a8954b65","size":4542,"type":"file"},{"mode":"0755","owner_policy":"target-root","path":"code-review/templates/ci-devops","type":"directory"},{"mode":"0644","owner_policy":"target-root","path":"code-review/templates/ci-devops/containerization.md","sha256":"ac10fccaae741587a08ed9e9540d3bcd22e8711e204e877f970b6c054fb858b2","size":4917,"type":"file"},{"mode":"0644","owner_policy":"target-root","path":"code-review/templates/ci-devops/pipeline_efficiency.md","sha256":"3f55ac9a629e5ee76aa6a80facfd646cfee8f7353f05d4d05d5043eb5c1a4fdc","size":5134,"type":"file"},{"mode":"0755","owner_policy":"target-root","path":"code-review/templates/code-quality","type":"directory"},{"mode":"0644","owner_policy":"target-root","path":"code-review/templates/code-quality/complexity_control_flow.md","sha256":"ce06cddb2024c919d4bd637e4987a7a28aeee42fc1c0234dd9d6aa519eb997cd","size":3425,"type":"file"},{"mode":"0644","owner_policy":"target-root","path":"code-review/templates/code-quality/coupling_cohesion.md","sha256":"397e4200873d342dde8067834060fcecdf46b1f34c84ed41ca8040a92618e9ea","size":3441,"type":"file"},{"mode":"0644","owner_policy":"target-root","path":"code-review/templates/code-quality/data_modeling.md","sha256":"338ae152a9bb0e83f8ca975c279c85ec94059e0b40353f4c57d9d360e8e385fd","size":3861,"type":"file"},{"mode":"0644","owner_policy":"target-root","path":"code-review/templates/code-quality/error_handling.md","sha256":"a986cb100fc9f894b20ff579a6adce5e12a7bc01a5c77d1fdc3867f3a3036df1","size":3659,"type":"file"},{"mode":"0644","owner_policy":"target-root","path":"code-review/templates/code-quality/naming_conventions.md","sha256":"232bb4f753142b17925c347de6d328472745c925a1a8e6c0299b213feaa64990","size":3524,"type":"file"},{"mode":"0644","owner_policy":"target-root","path":"code-review/templates/code-quality/pythonic_idioms.md","sha256":"4edcde5324db952d3fa61d92922bd6b3ae558e05040ddf8bc554b7ba1cdd2222","size":3946,"type":"file"},{"mode":"0644","owner_policy":"target-root","path":"code-review/templates/code-quality/structure_sizing.md","sha256":"b5586f0d5392f85affa2d23fb2a41e89d231ee1ce473cb4f5920aa02ca665399","size":3191,"type":"file"},{"mode":"0644","owner_policy":"target-root","path":"code-review/templates/code-quality/type_hints.md","sha256":"ef0bc4b28bee3f5b8bd688dcb00ea7303c74bc3079b5eb76b1dd9315ceb62096","size":3788,"type":"file"},{"mode":"0755","owner_policy":"target-root","path":"code-review/templates/concurrency","type":"directory"},{"mode":"0644","owner_policy":"target-root","path":"code-review/templates/concurrency/async_safety.md","sha256":"79e4339cbf36a2da4beef6643666fa40f38677fb5c6d538c4767a12cc75d2395","size":4854,"type":"file"},{"mode":"0755","owner_policy":"target-root","path":"code-review/templates/configuration","type":"directory"},{"mode":"0644","owner_policy":"target-root","path":"code-review/templates/configuration/env_management.md","sha256":"a2a77df18135a34319295cbdc2e1ef4a36c51943a44ce882b3da1742a7ab7e01","size":4982,"type":"file"},{"mode":"0755","owner_policy":"target-root","path":"code-review/templates/data-privacy","type":"directory"},{"mode":"0644","owner_policy":"target-root","path":"code-review/templates/data-privacy/pii_handling.md","sha256":"015fd7ee10e19726623e3fec738b684ff67c4c8e987f3a4ac030fc484797f7cb","size":4745,"type":"file"},{"mode":"0755","owner_policy":"target-root","path":"code-review/templates/dependency","type":"directory"},{"mode":"0644","owner_policy":"target-root","path":"code-review/templates/dependency/supply_chain.md","sha256":"60594b17d3b2da6a1ef4f2bbd2a3f91584b53f8e3867fa26592cad0d58a3fc82","size":4481,"type":"file"},{"mode":"0755","owner_policy":"target-root","path":"code-review/templates/documentation","type":"directory"},{"mode":"0644","owner_policy":"target-root","path":"code-review/templates/documentation/adrs.md","sha256":"a09118103526619cd7562a1d61bb3efc15eb700f40306b32f8c371a05627b312","size":2901,"type":"file"},{"mode":"0644","owner_policy":"target-root","path":"code-review/templates/documentation/api_contracts.md","sha256":"0d8520b08470b4eeb22fdef353338d254b05c3823f4a6070ec34c83bae7f32a9","size":3545,"type":"file"},{"mode":"0644","owner_policy":"target-root","path":"code-review/templates/documentation/code_comments.md","sha256":"92b1bd6eb4b3aee0889750050747025eafd9cb86f6f6af5f81ad158be3c1cd1f","size":3316,"type":"file"},{"mode":"0644","owner_policy":"target-root","path":"code-review/templates/documentation/readme_runbooks.md","sha256":"38ce52e86ae482aab09ad3fd9d1087f5cf938be6b34ad43807c18c496ee07653","size":3193,"type":"file"},{"mode":"0755","owner_policy":"target-root","path":"code-review/templates/observability","type":"directory"},{"mode":"0644","owner_policy":"target-root","path":"code-review/templates/observability/metrics_alerting.md","sha256":"8a15284581b41de6fcc5302a15394069c02b25f781a99f9450882a5e771c5b3a","size":4617,"type":"file"},{"mode":"0644","owner_policy":"target-root","path":"code-review/templates/observability/structured_logging.md","sha256":"2ebeb85fc7299fe4a6cafa72240c8ebc6802ecf58ada18cbf5ae689d4588102a","size":4743,"type":"file"},{"mode":"0755","owner_policy":"target-root","path":"code-review/templates/performance","type":"directory"},{"mode":"0644","owner_policy":"target-root","path":"code-review/templates/performance/algorithmic_complexity.md","sha256":"c9c0947aa7d874a96419662aef2532128f19b763b1f3109466ba110ec437f73f","size":3451,"type":"file"},{"mode":"0644","owner_policy":"target-root","path":"code-review/templates/performance/caching.md","sha256":"498d75db6870e1e3a5db8b6c62c3d09356b8f40182b5d68bc8da4415c880c309","size":4572,"type":"file"},{"mode":"0644","owner_policy":"target-root","path":"code-review/templates/performance/db_n_plus_1.md","sha256":"ed6d9df0bf7dd39f20adb934fa79007b79788b3f2f9086cfc3308920198d3491","size":3906,"type":"file"},{"mode":"0644","owner_policy":"target-root","path":"code-review/templates/performance/http_resilience.md","sha256":"2c39df598ad6dca518a5fc9a14f8c804051535bd2a5012c1cc9bd7c1549f76d1","size":6077,"type":"file"},{"mode":"0644","owner_policy":"target-root","path":"code-review/templates/performance/memory_resource_leaks.md","sha256":"337187ab075cb524a0edc66514ee33cf15c079284dddcd1f90db06abefc6893c","size":3830,"type":"file"},{"mode":"0755","owner_policy":"target-root","path":"code-review/templates/security","type":"directory"},{"mode":"0644","owner_policy":"target-root","path":"code-review/templates/security/authn_authz.md","sha256":"991274b40f805ab3e4d9d9de856158d025c3f168436ed9c0db635f06601288a1","size":3847,"type":"file"},{"mode":"0644","owner_policy":"target-root","path":"code-review/templates/security/input_validation.md","sha256":"01915323638d7859e93742f7f0127a453de896d0ccf0480f10befe4bbfedc3bc","size":3727,"type":"file"},{"mode":"0644","owner_policy":"target-root","path":"code-review/templates/security/least_privilege.md","sha256":"7423ed3b4546dbc68b1f07c5990d8c6dee1530390d99d2b1325e7d97dbff8f93","size":3671,"type":"file"},{"mode":"0644","owner_policy":"target-root","path":"code-review/templates/security/secrets_management.md","sha256":"72cdcfa712f3e4aab2b99c6ba6a59e76b966787741e93b5a33b21ee0be9364b5","size":3670,"type":"file"},{"mode":"0644","owner_policy":"target-root","path":"code-review/templates/security/ssrf_internal.md","sha256":"e74af5479e4fedfcf472f9fd0b1c12774c0608c4383133656051e578883719ce","size":3704,"type":"file"},{"mode":"0755","owner_policy":"target-root","path":"code-review/templates/test-quality","type":"directory"},{"mode":"0644","owner_policy":"target-root","path":"code-review/templates/test-quality/e2e_tests.md","sha256":"13864d7beed5253589fa2f3df4a8d65945f7f6b3c4ddf76be348843074d9f185","size":3627,"type":"file"},{"mode":"0644","owner_policy":"target-root","path":"code-review/templates/test-quality/integration_tests.md","sha256":"0b36b997ccdbd60d54f2eb6ed728cacddad07be7979742277ba7ce0e5153fb30","size":3880,"type":"file"},{"mode":"0644","owner_policy":"target-root","path":"code-review/templates/test-quality/property_tests.md","sha256":"e23f95becd0146cfbc200a50220ac90b9ad319c4a8021fae66b9a4690508189f","size":3803,"type":"file"},{"mode":"0644","owner_policy":"target-root","path":"code-review/templates/test-quality/test_performance.md","sha256":"7f4dcb0979c98aaad7ca2f154b1cf88bcb7a59e85d428ded4704bf7059d23636","size":3345,"type":"file"},{"mode":"0644","owner_policy":"target-root","path":"code-review/templates/test-quality/unit_tests.md","sha256":"8d294c60bff7f3ee5ef34f4280e973dea620f5b81cc94f9d249331494988a2f5","size":4772,"type":"file"},{"mode":"0755","owner_policy":"target-root","path":"file-mr","type":"directory"},{"mode":"0644","owner_policy":"target-root","path":"file-mr/SKILL.md","sha256":"d7e16082177ea3130ed7741e0fab